{"actor": 3, "after": {"activePlayer": 1, "currentRoll": null, "gameId": "sim-acceptance-v1-0", "initialContenders": [1], "phase": "await_roll", "pieces": [{"finishedSlot": null, "homeIndex": null, "id": "P1-1", "outerSteps": 0, "owner": 1, "position": null, "status": "reserve"}, {"finishedSlot": null, "homeIndex": null, "id": "P1-2", "outerSteps": 0, "owner": 1, "position": null, "status": "reserve"}, {"finishedSlot": null, "homeIndex": null, "id": "P1-3", "outerSteps": 0, "owner": 1, "position": null, "status": "reserve"}, {"finishedSlot": null, "homeIndex": null, "id": "P1-4", "outerSteps": 0, "owner": 1, "position": null, "status": "reserve"}, {"finishedSlot": null, "homeIndex": null, "id": "P1-5", "outerSteps": 0, "owner": 1, "position": null, "status": "reserve"}, {"finishedSlot": null, "homeIndex": null, "id": "P2-1", "outerSteps": 0, "owner": 2, "position": null, "status": "reserve"}, {"finishedSlot": null, "homeIndex": null, "id": "P2-2", "outerSteps": 4, "owner": 2, "position": "М17", "status": "track"}, {"finishedSlot": null, "homeIndex": null, "id": "P2-3", "outerSteps": 0, "owner": 2, "position": null, "status": "reserve"}, {"finishedSlot": null, "homeIndex": null, "id": "P2-4", "outerSteps": 0, "owner": 2, "position": null, "status": "reserve"}, {"finishedSlot": null, "homeIndex": null, "id": "P2-5", "outerSteps": 0, "owner": 2, "position": null, "status": "reserve"}, {"finishedSlot": null, "homeIndex": null, "id": "P3-1", "outerSteps": 0, "owner": 3, "position": null, "status": "reserve"}, {"finishedSlot": null, "homeIndex": null, "id": "P3-2", "outerSteps": 0, "owner": 3, "position": null, "status": "reserve"}, {"finishedSlot": null, "homeIndex": null, "id": "P3-3", "outerSteps": 0, "owner": 3, "position": null, "status": "reserve"}, {"finishedSlot": null, "homeIndex": null, "id": "P3-4", "outerSteps": 0, "owner": 3, "position": null, "status": "reserve"}, {"finishedSlot": null, "homeIndex": null, "id": "P3-5", "outerSteps": 0, "owner": 3, "position": null, "status": "reserve"}], "players": [1, 2, 3], "rollCount": 3, "rollSeriesCount": 0, "rulePolicy": {"cornerPriority": "per-unit", "homeFreeze": "contiguous-tail", "jumpEntry": "skip", "victory": "atomic"}, "rulesVersion": "v1", "turnOrder": [1, 2, 3], "winner": null}, "before": {"activePlayer": 3, "currentRoll": {"dice": [1, 4], "extraRoll": false, "id": 3, "remainingActions": [1, 4], "rollSequenceNumber": 1, "usedPoints": 0}, "gameId": "sim-acceptance-v1-0", "initialContenders": [1], "phase": "resolving_roll", "pieces": [{"finishedSlot": null, "homeIndex": null, "id": "P1-1", "outerSteps": 0, "owner": 1, "position": null, "status": "reserve"}, {"finishedSlot": null, "homeIndex": null, "id": "P1-2", "outerSteps": 0, "owner": 1, "position": null, "status": "reserve"}, {"finishedSlot": null, "homeIndex": null, "id": "P1-3", "outerSteps": 0, "owner": 1, "position": null, "status": "reserve"}, {"finishedSlot": null, "homeIndex": null, "id": "P1-4", "outerSteps": 0, "owner": 1, "position": null, "status": "reserve"}, {"finishedSlot": null, "homeIndex": null, "id": "P1-5", "outerSteps": 0, "owner": 1, "position": null, "status": "reserve"}, {"finishedSlot": null, "homeIndex": null, "id": "P2-1", "outerSteps": 0, "owner": 2, "position": null, "status": "reserve"}, {"finishedSlot": null, "homeIndex": null, "id": "P2-2", "outerSteps": 4, "owner": 2, "position": "М17", "status": "track"}, {"finishedSlot": null, "homeIndex": null, "id": "P2-3", "outerSteps": 0, "owner": 2, "position": null, "status": "reserve"}, {"finishedSlot": null, "homeIndex": null, "id": "P2-4", "outerSteps": 0, "owner": 2, "position": null, "status": "reserve"}, {"finishedSlot": null, "homeIndex": null, "id": "P2-5", "outerSteps": 0, "owner": 2, "position": null, "status": "reserve"}, {"finishedSlot": null, "homeIndex": null, "id": "P3-1", "outerSteps": 0, "owner": 3, "position": null, "status": "reserve"}, {"finishedSlot": null, "homeIndex": null, "id": "P3-2", "outerSteps": 0, "owner": 3, "position": null, "status": "reserve"}, {"finishedSlot": null, "homeIndex": null, "id": "P3-3", "outerSteps": 0, "owner": 3, "position": null, "status": "reserve"}, {"finishedSlot": null, "homeIndex": null, "id": "P3-4", "outerSteps": 0, "owner": 3, "position": null, "status": "reserve"}, {"finishedSlot": null, "homeIndex": null, "id": "P3-5", "outerSteps": 0, "owner": 3, "position": null, "status": "reserve"}], "players": [1, 2, 3], "rollCount": 3, "rollSeriesCount": 1, "rulePolicy": {"cornerPriority": "per-unit", "homeFreeze": "contiguous-tail", "jumpEntry": "skip", "victory": "atomic"}, "rulesVersion": "v1", "turnOrder": [1, 2, 3], "winner": null}, "captures": [], "controller": {"id": "tactical", "kind": "agent", "version": "baseline-v1"}, "decisionId": "fc2d7f0169cd9a0a6c976834b8822abd3f1a61049b6a311819e172f2616f20d5", "decisionKind": "pass", "dice": [1, 4], "eventSeq": 11, "gameId": "sim-acceptance-v1-0", "legalActions": [], "mode": "ai-ai", "provenance": {"eventHash": "f99df6dc2831329780d59f65534d1dd24a02ba20024501f45d84e25be658be8b", "geometryHash": "3bcd32b0d8af042ed2336fcf078bb3974f1632f7aece0237bf0925b95a745156", "logHead": "46f1f2cf066d3838039b7b533be36d010e85c037607b7e81574cfcbd073bbeae", "rulePolicy": {"cornerPriority": "per-unit", "homeFreeze": "contiguous-tail", "jumpEntry": "skip", "victory": "atomic"}, "rulesVersion": "v1"}, "result": {"actorOutcome": "win", "reward": 1, "status": "completed", "winner": 3}, "rollId": 3, "schemaVersion": "shashbesh-decision-v1", "selectedAction": null}